{
  "actor": "release agent",
  "targetSystem": "GitHub",
  "action": "create release-candidate pull request",
  "payloadSummary": "Open a PR with verification notes and release-candidate checklist.",
  "payload": {
    "title": "Release candidate: skill approval brief initial public build",
    "body": "Verification commands passed.",
    "token": "do-not-print"
  },
  "impact": "Creates a reviewable PR branch. It does not merge, publish, or tag a release.",
  "rollback": "Close the PR and delete the branch if it is not useful.",
  "approvalText": "Approve release agent to create a GitHub PR for skill-approval-brief-skill."
}
